{
  "intake_id": "intake_alpha_2026",
  "created_at": "2026-06-15T14:30:00Z",
  "created_by": "consultant_a",
  "client_profile": {
    "organization_label": "client_alpha",
    "organization_type": "distributor",
    "size_indicator": "medium",
    "locations_count_indicator": "few",
    "geographies": ["north_america"]
  },
  "industry": "industrial parts distribution",
  "operating_model": "make-to-stock distribution from a central warehouse to regional branches",
  "inventory_environment": {
    "product_categories": ["fasteners", "fittings", "safety_equipment"],
    "storage_types": ["racked", "bulk", "small_parts_bins"],
    "sku_count_indicator": "tens_of_thousands",
    "throughput_indicator": "moderate",
    "inventory_value_indicator": "high"
  },
  "known_systems": [
    { "name": "ERP", "category": "ERP", "role": "system of record for stock and orders", "notes": "aging on-premise deployment" },
    { "name": "spreadsheets", "category": "spreadsheet", "role": "branch-level reorder tracking", "notes": "maintained per branch, not integrated" }
  ],
  "stated_pain_points": [
    {
      "description": "Frequent stockouts on fast-moving SKUs despite reported stock on hand",
      "impact_indicator": "high",
      "evidence_references": ["evid_alpha_001"]
    },
    {
      "description": "Physical counts routinely disagree with the ERP",
      "impact_indicator": "high",
      "evidence_references": ["evid_alpha_002"]
    }
  ],
  "stakeholders": [
    { "role": "operations_manager", "anonymized_label": "stakeholder_1", "involvement": "primary sponsor" },
    { "role": "warehouse_lead", "anonymized_label": "stakeholder_2", "involvement": "day-to-day operations" },
    { "role": "finance_controller", "anonymized_label": "stakeholder_3", "involvement": "inventory valuation" }
  ],
  "urgency": {
    "level": "high",
    "business_trigger": "an external stock-count audit flagged material discrepancies"
  },
  "available_data_sources": [
    { "name": "ERP stock-on-hand export", "type": "system_export", "availability": "on_request" },
    { "name": "last cycle-count report", "type": "report", "availability": "available" },
    { "name": "branch reorder spreadsheets", "type": "spreadsheet", "availability": "restricted" }
  ],
  "initial_scope_hypothesis": "Inventory record accuracy is being eroded by uncontrolled adjustments and unreconciled branch processes; focus the assessment on counting discipline and adjustment controls.",
  "first_billing_tranche_objective": "Deliver an evidence-based initial assessment that quantifies record-accuracy issues and identifies quick wins, positioning a scoped next-phase remediation engagement.",
  "assessment_readiness": {
    "status": "partially_ready",
    "blockers": ["ERP export access pending IT approval", "branch spreadsheet access restricted"],
    "notes": "Site walk-around can proceed while data access is arranged."
  },
  "evidence_references": ["evid_alpha_001", "evid_alpha_002"],
  "consultant_notes": "Sponsor is motivated by the audit finding; move quickly on the walk-around to build early evidence."
}
